,카테고리,기사제목,전문,키워드
7,economy,서울 휘발유 L당 2천원 '올라도 너무 오른다'…가격 어떻게 정해지나?," = 러시아의 우크라이나 침공 사태 이후 국제유가가 급등한 영향으로 서울 지역 주유소의 휘발유 평균 판매가격도 리터(L)당 2천원선을 돌파했다.</p><p> 정부의 유류세 인하 조치 이후 올해 초 1천687원(1월 8일)까지 떨어졌던 서울 휘발유 가격은 국제유가를 따라 빠르게 올랐고, 이달 8일 1천900원 선을 넘은 지 사흘 만인 11일 2천원 선도 넘어섰다.</p><p> 이런 기세라면 전국 평균 휘발유 가격도 수일 내에 2천원을 넘을 것으로 보인다.</p><p> 이를 두고 일각에선 국내 기름값이 최근 국제유가 상승분보다 더 크게 올랐다는 주장이 나온다. 또한 국내 휘발유 가격이 국제유가를 따라 오를 땐 빨리 오르지만, 반대로 내릴 때는 속도가 더디다는 볼멘소리도 있다.</p><p> 그렇다면 국내 주유소에서 판매하는 휘발유의 가격은 어떤 과정을 거쳐 정해지는 것일까.<br/></p><p> ◇ 원유가격＋유류세＋정유사 마진으로 결정…L당 798원이 세금</p><p> 12일 정유업계에 따르면 국내 주유소의 휘발유 판매 가격은 원유 도입 비용과 원유를 국내로 반입할 때 부과되는 관세, 휘발유에 붙는 각종 세금(유류세), 정유사와 주유소의 마진이 종합적으로 반영돼 결정된다.</p><p> 정유사가 해외 시장에서 원유를 구매해 국내로 들여오고, 이를 국내 정유시설에서 정제해 전국 각지의 주유소로 유통시키는 데까지는 통상 2~3주의 시간이 걸린다.</p><p> 한국석유공사 유가정보사이트 오피넷에 따르면 이달 첫째 주 전국 주유소 평균 휘발유 판매 가격은 L당 1천764원이었는데 2주 전인 2월 셋째 주 싱가포르에서 거래된 국제 휘발유 가격(보통휘발유 해당 92RON 기준)은 L당 817원이었다.</p><p> 국내 주유소 휘발유 판매 가격의 46% 수준이다.</p><p> 여기에다 원유 가격의 3% 수준인 관세(L당 약 25원)와 준(準)조세격인 석유수입부과금(L당 정액 16원), 정유사 유통비용과 마진 등 88원이 더해져 정유사의 '세전' 휘발유 판매가격이 결정된다.</p><p> 3월 첫째 주 정유사들의 평균 세전 휘발유 판매 가격은 946원이었다.</p><p> 이 세전 가격에 유류세와 부가세 등 각종 세금이 추가된다. 3월 첫째 주 기준 휘발유 1L에 부과되는 유류세(교통에너지환경세·주행세·교육세)와 부가세 등 세금은 751원 안팎이다.</p><p> 세금을 더한 정유사들의 '세후' 판매가격(정유사 휘발유 공급가격)은 L당 1천697원이고, 여기에다 주유소 유통비용과 마진 등 67원을 포함하면 최종 소비자 판매 가격(1천764원)이 나온다.</p><p> 원래 휘발유에 붙는 유류세는 L당 820원이지만, 정부는 국제유가 급등에 따른 물가 상승을 우려해 지난해 11월 유류세를 20%(164원) 인하했다. 현재 기준 유류세는 L당 656원이다.</p><p> 3월 첫째 주 기준 최종 휘발유 가격에 반영된 관세와 유류세, 부가세 등 전체 세금은 총 798원으로, 최종 판매 가격의 45%를 차지한다.</p><p> 국내 휘발유 가격은 국제 휘발유 가격을 2~3주가량의 시차를 두고 따라가는 경향이 있다. 국내 휘발유 가격은 최근 8주 연속으로 상승세를 보이고 있지만, 국제유가의 상승세를 고려할 때 당분간 국내 가격 상승세가 이어질 전망이다.<br/></p><p> ◇ ""소비자들이 가격 인상에 더 민감하게 반응…유통 구조도 영향""</p><p> 일각에서는 국내 휘발유 가격 등락 움직임에 의구심을 제기한다. 국제유가 상승기 때는 국내 휘발유 가격의 오름세가 가파르지만, 유가 하락기에는 내려가는 속도가 더디다는 것이다.</p><p> 이에 대해 정유업계는 가격 수준에 따라 소비자들의 민감도가 다르고, 휘발유 유통구조 상의 특성 때문에 생기는 현상이라고 설명한다.</p><p> 휘발유 가격이 오르는 시기에는 물가 부담이 커지면서 소비자들이 체감하는 가격 상승 폭이 더 크게 느껴지지만, 반대로 가격 하락 국면에선 가격에 대한 소비자들의 민감도가 다소 둔화되는 경향이 있다는 것이다.</p><p> 한 업계 관계자는 ""소비자들은 가격 상승을 하락보다 훨씬 민감하게 받아들이는 경향이 있다""며 ""국제유가가 하락세로 전환했을 때도 시차 때문에 국내 휘발유 가격은 2~3주 동안 계속 오르는데 이 시기에 특히 국내 가격에 대한 불만이 커진다""고 말했다.</p><p> 이에 더해 소비자의 주유 습관과 휘발유의 유통 구조도 이 같은 인식에 영향을 미친다는 게 업계 관계자들의 분석이다.</p><p> 유가 상승기에는 소비자들이 조금이라도 더 싼 가격에 기름을 넣기 위해 주유소를 더 일찍 찾는데 그 결과 재고가 조기에 소진된 주유소들이 정유사로부터 더 비싸진 가격에 새 휘발유 물량을 공급받는다는 것이다.</p><p> 반대로 유가 하락기에는 소비자들이 주유를 최대한 늦추면서 주유소 재고 소진 속도가 늦어지고, 이로 인해 새 물량 공급이 늦어지면서 주유소 판매 가격도 그만큼 천천히 내려간다는 설명이다.</p><p> 다만 이를 고려하더라도 최근 국내 기름값 상승세는 국제유가 움직임에 비해 과도하다는 소비자단체의 지적이 나온다.</p><p> ㈔에너지·석유시장감시단은 지난해 11월 정부의 유류세 인하 조치 이후 4개월간 유가 변동 추이를 분석한 결과 유류세 인하분(164원↓)이 국제유가 상승분(88원↑)보다 더 커 국내 휘발유 가격은 최종적으로 L당 76원 인하됐어야 하지만 오히려 100원가량 인상된 것으로 나타났다고 주장했다.</p><p> 이서혜 에너지·석유시장감시단 연구실장은 ""국내 휘발유 가격은 최근의 국제유가 상승세를 고려하더라도 지나치게 과도하게 올랐다""며 ""정부가 정유사와 주유소에 대해 모니터링을 강화할 필요가 있다""고 말했다.</p><p> 이에 대해 대한석유협회 관계자는 ""국제유가가 국내 가격에 반영되는 시차가 일정하지 않아 비교 시점에 따라 결괏값이 달라질 수 있다""며 ""중장기적인 추세로 보면 국내 휘발유 가격은 국제유가에 비례한다""고 밝혔다.</p>",주유소
8,economy,"인천경제청, 송도·청라 잔여부지 4곳에 기업 유치"," = 인천경제자유구역청은 송도·청라국제도시에 남아 있는 부지 175만㎡를 활용해 기존 산업클러스터와 시너지를 높일 수 있는 기업들을 유치하겠다고 10일 밝혔다.</p><p> 대상 부지는 ▲ 송도 11공구 97만4천㎡ ▲ 송도 4·5·7공구 14만5천㎡ ▲ 청라 5-4블록 18만8천㎡ ▲ 청라 6블록 45만㎡ 등 4곳이다.</p><p> 현재 세계적 경쟁력을 갖춘 바이오클러스터가 구축된 송도국제도시에서는 새로 매립한 11공구에 바이오산업 앵커기업과 바이오융합·신산업 분야 중소·중견기업을 추가로 유치할 계획이다.</p><p> 개발이 마무리 단계에 접어든 송도 4·5·7공구에는 이미 입주한 기업들의 증액 투자를 유도하고 국책연구기관과 연구개발 중심 강소기업을 유치한다는 구상이다.</p><p> 청라국제도시에서는 투자유치 부지 5-4블록에 영상·문화콘텐츠단지 사업자를 공모해 최근 급성장하고 있는 OTT(온라인 동영상 서비스) 시장 공략에 나서기로 했다. 청라 6블록에는 다수의 공모 제안 프로젝트를 검토 중이다.</p><p> 인천경제청 관계자는 ""인천경제자유구역 개발 사업이 성숙 단계에 진입하면서 얼마 남지 않은 투자 유치 부지를 효율적으로 활용해야 하는 상황""이라며 ""선택과 집중을 통해 기존의 지역 특화산업과 최대한 시너지를 내도록 하겠다""고 말했다.</p>",인천경제자유구역청
9,economy,"""대장동 사업, 확정이익 방식이라 의아""…김민걸 법정 증언"," = 로비·특혜 의혹을 받는 대장동 사업의 공모지침서 작성에 관여했던 김민걸 회계사는 확정이익만 성남도시개발공사가 가져가는 구조를 의아하게 여겼다고 법정에서 진술했다.</p><p> 김 회계사는 11일 서울중앙지법 형사합의22부(이준철 부장판사) 심리로 열린 유동규 전 성남도시개발공사(성남도개공) 기획본부장, 화천대유자산관리(화천대유) 대주주 김만배씨, 남욱 변호사, 정영학 회계사, 정민용 변호사의 13회 공판에 증인으로 출석했다.</p><p> 검찰은 이날 주신문에서 김 회계사에게 ""공모지침서 초안을 정민용 변호사와 함께 보면서 어떤 대화를 나눴는지 기억나는 대로 떠올려서 말해달라""고 했다.</p><p> 이에 김 회계사는 ""확정이익 방식이라고 저에게 보고됐을 때 조금 의외였다""고 말했다. 검찰이 재차 ""(성남도개공이) 확정이익을 받는 것이 왜 의아했나""라고 묻자, 김 회계사는 ""지분 참여라면 보통 지분율대로 (이익을) 나누는 걸 상식으로 가졌는데 예상 밖에 확정이익 방식이라 의아했다""고 했다.</p><p> 대장동 사업의 공모지침서는 성남도개공의 의뢰를 받은 민간 연구기관에서 초안을 작성하고 이 초안을 토대로 성남도개공 전략사업팀이 완성시킨 문건이다.</p><p> 검찰은 이 공모지침서에 공사의 수익을 1천800억여원으로 제한하는 내용이 담겼고, 이는 유동규 전 본부장이 김씨 등과 공모해 화천대유 측에 이익을 몰아주기 위한 목적이었다고 보고 있다.</p><p> 남욱 변호사의 소개로 공사에 들어가 전략사업팀 내 파트장을 맡고 있던 정민용 변호사는 이 공모지침서 작성을 주도한 것으로 알려졌고, 김 회계사는 정 변호사의 상급자인 전략사업팀장이었다.<br/></p><p> 김 회계사는 또 정민용 변호사가 상급자인 자신을 거치지 않고 유 전 본부장에게 직접 보고한 사례가 많았다고 설명했다. 검찰이 ""대장동 사업 관련 업무를 정민용 피고인이 증인을 거치지 않고 유동규 피고인에게 보고했나""라고 묻자, 김 회계사는 ""그런 사례가 많다""고 답했다.</p><p> 재판장이 ""원론적으로 정민용 피고인이 유동규 피고인에게 대장동 사업 업무를 보고할 때 증인과 의견을 나누거나 증인을 통해 보고해야 하는 시스템이 맞는가""라고 묻자, 김 회계사는 ""원칙은 그게 맞는다""며 ""본부장에게 직접 보고하더라도 내용을 제가 알아야 한다""고 설명했다.</p><p> 검찰은 ""이 문제로 증인이 정민용 피고인에게 '왜 그렇게 행동하냐'고 말한 적이 없나""라고 물었고, 김 회계사는 ""그런 문제로 갈등이 있었던 것은 맞는다""고 인정했다.</p><p> 한편 재판부는 이날 김 회계사에 앞서 공사에서 팀장으로 근무하는 이모 씨도 증인으로 불러 신문했다. 이씨는 앞선 공판에도 출석했으나 신문이 길어져 이날 두 번째로 신문을 받았다.</p><p> 검찰이 ""공모지침서에 민간 사업자에게 많은 이익을 수취할 기회를 부여한 반면 공사의 배당 이익을 박탈해 부당한 조건이라고 생각하지 않았나""라고 묻자, 이씨는 ""그건 시정(市政)을 책임지시는 분이 판단할 사항이어야 한다""고 대답했다.</p><p> 재판부가 ""공사의 추가이익 배당 기회를 원천적으로 제한하는 부당한 조건이라고 생각했는지 묻는 것""이라고 재차 질문하자, 이씨는 ""공모지침서를 검토할 시간이 길지 못해 그런 내용을 생각해본 적이 없다""고 선을 그었다.</p>",대장동
10,society,"김건희 여사, 통화 녹음 공개한 서울의소리 상대 손배소"," = 윤석열 대통령 당선인의 배우자 김건희 여사가 지난 1월 자신과 통화한 내용을 녹음해 공개한 인터넷 언론사 '서울의 소리' 관계자들을 상대로 소송을 낸 것으로 뒤늦게 확인됐다.</p>를 상대로 1억 원을 청구하는 손해배상 소송을 제기했다.</p><p> 김 여사는 소장에서 자신을 ""국민의힘 20대 대통령 선거 윤석열 후보자의 배우자""라고 소개하며 ""피고들의 불법적인 녹음 행위와 법원의 가처분 결정 취지를 무시한 방송으로 인격권과 명예권, 프라이버시권, 음성권을 중대하게 침해당했다""고 주장했다.</p><p> 법원은 이 사건을 환경·언론 사건 담당 재판부인 민사201단독 김익환 부장판사에 배당했다. 재판부는 아직 변론 또는 변론준비 기일을 지정하지는 않았다.</p>는 대선을 앞둔 지난 1월 중순 김 여사와 통화한 내용을 녹음했다며 MBC와 협업해 녹음 내용을 공개하겠다고 밝혔다.</p><p> 이에 김 여사는 녹음파일을 공개하지 못하게 해달라며 MBC와 서울의 소리를 상대로 가처분을 신청했지만, 법원은 일부 사생활과 관련한 내용만 제외하고 공개를 허용하는 취지의 결정을 내렸다.</p>의 통화 내용을 공개했다.</p>",김건희
11,society,"디씨 '이재명 갤러리' 관리자 실종 소동…경찰, 신병 확보"," = 더불어민주당 이재명 후보와 관련된 온라인 커뮤니티의 관리자가 이 후보의 낙선 확정 직후 유서를 남기고 실종됐다가 경찰에 발견되는 소동이 벌어졌다.</p><p> 11일 경찰에 따르면 경기 시흥경찰서는 전날 오후 3시께 물왕동 물왕저수지 인근에서 '디시인사이드 이재명 갤러리' 관리자인 A(31)씨를 발견해 가족에게 신병을 인계했다. A씨는 건강에 별다른 문제는 없는 상태였다. 그가 현장에서 극단적 선택을 시도한 흔적은 발견되지 않은 것으로 전해졌다.</p><p> A씨는 전날 오전 10시께 이재명 갤러리에 ""영혼 절반이 떨어져 나간 것 같다""며 ""이곳을 총괄하는 동안 온갖 음해와 협박에 시달려 그 고통은 이루 말할 수가 없다""는 내용의 유서를 남기고 휴대전화를 끈 채 연락이 두절됐다.</p><p> 그는 유서에 ""어렸을 때는 (극단적 선택을 한) 민영환과 전태일이 왜 죽었는지 이해가 가지 않았는데 이제야 이해가 된다""면서 ""스스로를 제물로 내던져서라도 사람들에게 호소하고 거대한 부정적 흐름을 막고 싶은 심정이었기 때문""이라고 적었다.</p><p> 이후 글을 본 커뮤니티 회원들과 가족이 경찰에 실종 신고를 했다. 시흥경찰서는 A씨 아버지의 신고를 접수한 서울 은평경찰서로부터 전날 오후 2시 40분께 관련 공조 요청을 받고 수색에 나섰다.</p><p> 앞서 이 후보는 지난해 11∼12월 이재명 갤러리에 세 차례 글을 올려 2030세대 남성을 겨냥한 정책 등을 발표했다.</p>",이재명
12,society,"외교부, '우크라 무단입국' 이근 전 대위 경찰에 고발"," = 외교부가 국제의용군에 참여하겠다며 여행금지 지역인 우크라이나에 무단으로 입국한 이근 전 대위를 여권법 위반 혐의로 경찰에 고발했다.</p><p> 11일 외교 소식통에 따르면 외교부는 전날 오후 경찰청에 이씨에 대한 고발장을 냈다.</p><p> 외교부는 이씨가 사회관계망서비스(SNS)에 공개한 사진을 통해 함께 우크라이나로 출국했다고 주장한 신원 미상의 2명도 함께 고발한 것으로 전해졌다.</p><p> 경찰청은 이씨 사건을 서울경찰청 국제범죄수사대로 배당해 수사할 예정이다.</p><p> 유튜브 콘텐츠 '가짜 사나이'로 이름을 알린 해군특수전전단(UDT/SEAL) 대위 출신인 이씨는 지난 7일 의용군 참여를 위해 우크라이나로 출국했다고 SNS를 통해 주장했으며, 이후 정부는 이씨가 실제로 우크라이나에 입국한 사실을 확인했다.</p><p> 우크라이나 전역은 지난달 13일부터 여행금지 지역으로 지정돼 한국 국민이 여권법에 따른 정부의 예외적 여권사용 허가를 받지 않고 입국하면 형사처벌 대상이 된다.</p><p> 외교부는 이씨에 대해 ""향후 여권법 위반 관련 형사 고발도 추진할 예정""이라고 지난 8일 예고한 바 있다.</p><p> 정부는 이씨에게 현재 소지 중인 여권에 대한 반납 명령도 조만간 통지할 예정이다.</p><p> 한편 정부의 여행금지 조처 이후 우크라이나 체류 국민 수는 지속적으로 감소해 이씨 일행과 크림지역 교민 등을 제외하면 이날 오후 10시(현지시간 오후 3시) 현재 28명이 현지에 머무르고 있다.</p><p> 전날 오후 10시 기준 30명에서 2명이 감소한 수치다. 이들 2명은 공관 지원 하에 폴란드로 안전하게 대피했다. 아울러 9명이 추가로 현지 상황을 봐 가면서 출국할 예정이라고 외교부는 덧붙였다.</p>",외교부
13,society,구치소에서 오는 손편지…스토킹 피해자는 공포에 떨었다," = 헤어진 여성을 스토킹한 혐의로 구속돼 재판을 받는 30대 남성이 피해자에게 '그립다, 나랑 결혼하자' 등의 내용이 담긴 편지를 보냈다가 경찰에 추가로 입건됐다.</p><p> 12일 연합뉴스 취재를 종합하면 서울 마포경찰서는 A(35·구속기소)씨를 스토킹 범죄의 처벌 등에 관한 법률(스토킹처벌법) 위반 혐의로 입건해 조사 중이다.</p><p> 구치소에 수감 중인 A씨는 이달 3일·6일, 지난달 15일·20일 총 네 차례에 걸쳐 피해자에게 손편지를 보낸 혐의를 받는다. 지난달 보낸 편지에는 '결혼해서 애 낳고 행복하게 살자. 접견을 와 달라' 등의 내용이 포함된 것으로 전해졌다.</p><p> 피해자가 답장을 보내지 않자 A씨는 이달 보낸 편지에 '어떻게 할지 답장은 해줘야지 피한다고 해결될 문제가 아니잖아', '하루빨리 합의서가 들어가야 하니 부탁한다'라고 적었다. 구치소 생활비가 부족하다며 자신의 계좌번호를 적기도 했다.</p><p> 피해자는 지난달 말 편지를 받은 즉시 경찰에 신고했다. 경찰은 잠정조치 1∼3호(각각 스토킹 중단 서면 경고·100ｍ 이내 접근 금지·전기통신을 이용한 접근 금지)를 법원에 신청해 받아들여졌다. 그러나 A씨는 이를 무시하고 재차 편지를 보냈고, 피해자는 이달 10일 다시 경찰 신고를 했다.</p><p> 앞서 A씨는 지난해 교제 중이던 피해자가 외출하지 못하도록 신발과 옷을 버리고, 휴대전화를 빼앗아 지인과도 연락하지 못하도록 연락처를 차단한 것으로 알려졌다. 연락이 닿지 않으면 가족을 살해하겠다는 협박도 한 것으로 전해졌다.</p><p> 참다못한 피해자는 지난해 12월 스토킹을 당하고 있다며 처음 신고를 했다. 당시 관할 지구대에서 신고를 접수하는 약 2시간 동안에도 A씨는 ""한 시간 안에 안 오면 죽여 버린다""며 피해자에게 130통 넘게 전화한 것으로 알려졌다.</p><p> 그는 같은 달 피해자에게 다시 접근했다가 긴급체포된 것으로 알려졌다. 이후 스토킹 범죄에 대한 원활한 조사 또는 피해자 보호를 위해 필요하다고 인정되는 경우 가해자를 최대 한 달간 경찰서 유치장이나 구치소에 가두는 '잠정조치 4호'를 적용받아 구속당한 것으로 알려졌다. 지난 1월 초 재판에 넘겨진 그는 이달 말 서울서부지법에서 1심 선고를 앞두고 있다.</p><p> 피해 여성은 ""이제 겨우 일상을 회복하려는데 자꾸 편지가 오니까 끝난 것 같지 않고 계속 불안하다""며 신체적·정신적 고통을 호소했다. 그는 ""제발 안정을 찾을 수 있게 법원에서 필요한 조처를 해 줬으면 좋겠다""고 덧붙였다.</p>",피해자
14,society,"2년 끈 '한동훈 채널A 의혹' 사건, '대선 종료'에 마침표 찍나(종합)"," = 대선 정국이 국민의힘 윤석열 당선인의 승리로 마무리되면서 채널A 사건에 얽혀있는 한동훈 사법연수원 부원장(검사장)에 대한 수사 종결도 머지않았다는 관측이 나온다.</p><p> 12일 법조계에 따르면 서울중앙지검 형사1부(이선혁 부장검사)는 '채널A 사건'과 관련해 강요미수 혐의로 고발된 한 검사장 사건을 수사하고 있다.</p>와 한 검사장을 고발한 지 근 2년째다.</p>를 강요미수 혐의로 구속기소했지만, 한 검사장 처분은 유보했다.</p><p> 중앙지검 수사팀은 이후 수사 과정에서 한 검사장의 공모 혐의를 입증할 증거를 찾지 못해 무혐의 처분하겠다는 취지의 보고를 상부에 올렸다. 그러나 친정부 성향인 이성윤 당시 서울중앙지검장(현 서울고검장)은 한 검사장 휴대전화를 포렌식 할 때까지 기다려보자며 수사팀의 의견을 반려해왔다.</p><p> 지난해 검찰 인사 이후 새롭게 구성된 수사팀도 상부에 무혐의 처분을 해야 한다는 보고를 올렸으나 반려됐다는 설이 돌았다.</p><p> 이에 중앙지검 측은 현 수사팀이 해당 사건 처분과 관련한 결재를 올린 적은 없다는 취지로 부인했다.</p>는 지난해 7월 1심에서 무죄 판결을 받았다.</p><p> 법조계에서는 이들 검찰 지휘부가 한 검사장 사건을 장기간 붙들고 있었던 건 정치적 이유에서라는 분석이 많았다. 대선을 앞둔 상황에서 야권 후보인 윤 당선인의 최측근을 무혐의 처분하면 그동안 '검언유착' 프레임을 검찰개혁의 한 명분으로 내세웠던 여권이 역공당할 소지가 컸다는 얘기다.</p><p> 이 때문에 대선이 끝나면서 정치적 긴장 상태가 다소 해소됐으니 검찰로서도 사건 처리에 따르는 부담을 덜었다는 관측이 나온다. 더욱이 한 검사장이 윤석열 정부의 유력한 차기 서울중앙지검장으로 거론되고 있어 새 정부 출범 전에 사건을 마무리 지어야 할 현실적 필요성도 생겼다.</p><p> 다만 검찰이 정치적 고려 때문에 한 검사장 사건을 처리하지 않았다는 점을 자인하는 셈도 돼 적지 않은 고민과 결단이 필요할 것이란 전망도 있다.</p>",한동훈
15,international,"뉴질랜드서 스카이다이빙 즐기던 여성, 공중 충돌사고로 숨져","<p> (오클랜드=연합뉴스) 고한성 통신원 = 뉴질랜드에서 스카이다이빙을 즐기던 여성이 공중에서 다른 사람과 충돌해 사망하는 사고가 발생했다. </p><p> 텔레비전뉴질랜드(TVNZ) 1뉴스 등 현지 매체들은 10일 오후 오클랜드 서쪽 무리와이 해변에서 여러 사람과 함께 스카이다이빙을 하던 여성이 다른 사람과 부딪친 뒤 바다에 떨어져 숨졌다고 11일 전했다. </p><p> 경찰 관계자는 ""초기 정보로는 많은 사람이 그룹으로 스카이다이빙을 하던 중 두 사람이 공중에서 충돌했다""며 ""여성 다이버가 불행하게도 바다로 떨어져 현장에서 숨졌다""고 밝혔다.</p><p> 이 여성과 충돌한 사람은 20대 남성으로 가벼운 상처를 입고 오클랜드로 병원으로 옮겨졌다. </p><p> 한 목격자는 제트스키가 사고 현장으로 출동해 바다에 떨어진 스카이다이버에게 10여 분 동안 심폐소생술을 하고 경찰 헬기가 상공을 선회했다고 전했다. </p><p> 사고가 난 다이빙 사업체인 스카이다이브오클랜드는 2만 피트(약 6천ｍ) 상공에서 교관과 함께 뛰어내리는 탠덤 점프 서비스도 제공하는 것으로 알려졌다. </p>",뉴질랜드
