,카테고리,기사제목,전문,키워드
16,international,"[우크라 침공] 아프간과 다르구나…미 ""우크라 항전의지 과소평가"" 시인"," = 미국 정보당국 수장들이 러시아 침공에 맞서 싸우려는 우크라이나의 의지를 과소평가했던 실수를 시인했다고 AP통신이 10일(현지시간) 보도했다.</p><p> 스콧 베리어 미 국방정보국(DIA) 국장은 이날 미 상원 정보위원회 청문회에 출석해 ""여러 요소를 토대로, 우크라이나가 생각한 수준만큼 준비돼 있지 않았다는 게 기존 평가였다. 그런 만큼 우크라이나의 항전 의지에도 의문을 품었다""고 말했다.</p><p> 그러면서 ""이는 잘못된 평가였다. 우크라이나는 용감하고 명예롭게 싸웠고, 해야 할 일을 하고 있다""며 설명했다. </p><p> 그는 블라디미르 푸틴 러시아 대통령도 자국군이 우크라이나군을 압도할 역량이 있다고 본 듯하다며, 결과적으로 미·러가 모두 오판한 셈이 됐다고 밝혔다.</p><p> 그는 ""항전 의지와 사기를 측정하는 일은 어려운 분석 업무다. 내부에서도 조직마다 판단이 달랐고, 최소한 정보조직 수장으로서는 내가 할 수 있는 만큼 성과를 내지 못했다""고 말했다.</p><p> 애브릴 헤인스 국가정보국(DNI) 국장도 이날 출석해 푸틴 대통령이 우크라이나의 저력을 과소평가했다면서도 DNI 역시 러시아군이 이 정도 저항에 직면할 것이라고 예상치 못했다고 시인했다.</p><p> 관련 질의를 한 톰 코튼 미 공화당 상원의원은 외국군의 사기를 측정하는 일은 유난히 어려운 일이라고 두둔하면서도, 정보당국의 오판이 미국·서방 등이 초기 방침을 정하는 데 악영향을 끼쳤을 수 있다고 지적했다.</p><p> 그는 ""조 바이든 미국 대통령이나 다른 북대서양조약기구(NATO·나토) 소속 국가 지도자들이 생각하기에 우크라이나에 무기를 제공해도 몇시간 만에 러시아의 손아귀로 떨어질 수 있다고 본 만큼, 이런 실수들이 실제 (전쟁을 둘러싼) 국가 정책에 잠재적으로 영향을 미쳤다고 본다""고 말했다.</p><p> AP통신은 미 정보당국이 지난해 이슬람 무장조직 탈레반이 빠른 속도로 아프가니스탄을 점령할 당시에도 잘못된 판단을 냈었다고 지적했다.</p><p> 탈레반의 진격 속도를 오판하고 아프간 정부군의 방어 능력을 과신하는 바람에 지난해 8월 15일 탈레반이 수도 카불까지 함락하며 정권을 장악하는 예상치 못한 결과가 빚어졌다.</p><p> 미국이 20년간 훈련시키고 무장을 지원했지만, 내부 부패로 얼룩진 데다 사기가 바닥을 쳤던 정부군은 변변한 저항도 못한 채 주요 거점을 탈레반에 넘겨줬다.</p><p> 아프간 정부군이 최소 연말까지는 버텨줄 것이라는 정보당국의 예상이 허무하게 빗나간 지점이기도 했다.</p><p> 최근 미 정보당국 청문회는 우크라이나를 침공하려는 러시아의 움직임에 대한 기밀정보를 전례없는 수준으로 공개해 러시아를 견제했다는 평가를 받았다.</p><p> 정보당국은 이례적으로 침공 구실을 만들려는 러시아의 '자작극' 추정 사례를 여러 차례 공개하며 '첩보 공세'를 폈다.</p><p> 미 의회는 이런 정보당국의 조치가 당장 푸틴 대통령의 침공 명령을 막지는 못했지만, 서방이 제재나 무기·재정 지원 논의 등을 발 빠르게 준비할 수 있는 토대가 된 것으로 평가한다고 AP통신은 전했다.</p>",우크라이나
17,international,"외교부, '우크라 무단입국' 이근 전 대위 경찰에 고발"," = 외교부가 국제의용군에 참여하겠다며 여행금지 지역인 우크라이나에 무단으로 입국한 이근 전 대위를 여권법 위반 혐의로 경찰에 고발했다.</p><p> 11일 외교 소식통에 따르면 외교부는 전날 오후 경찰청에 이씨에 대한 고발장을 냈다.</p><p> 외교부는 이씨가 사회관계망서비스(SNS)에 공개한 사진을 통해 함께 우크라이나로 출국했다고 주장한 신원 미상의 2명도 함께 고발한 것으로 전해졌다.</p><p> 경찰청은 이씨 사건을 서울경찰청 국제범죄수사대로 배당해 수사할 예정이다.</p><p> 유튜브 콘텐츠 '가짜 사나이'로 이름을 알린 해군특수전전단(UDT/SEAL) 대위 출신인 이씨는 지난 7일 의용군 참여를 위해 우크라이나로 출국했다고 SNS를 통해 주장했으며, 이후 정부는 이씨가 실제로 우크라이나에 입국한 사실을 확인했다.</p><p> 우크라이나 전역은 지난달 13일부터 여행금지 지역으로 지정돼 한국 국민이 여권법에 따른 정부의 예외적 여권사용 허가를 받지 않고 입국하면 형사처벌 대상이 된다.</p><p> 외교부는 이씨에 대해 ""향후 여권법 위반 관련 형사 고발도 추진할 예정""이라고 지난 8일 예고한 바 있다.</p><p> 정부는 이씨에게 현재 소지 중인 여권에 대한 반납 명령도 조만간 통지할 예정이다.</p><p> 한편 정부의 여행금지 조처 이후 우크라이나 체류 국민 수는 지속적으로 감소해 이씨 일행과 크림지역 교민 등을 제외하면 이날 오후 10시(현지시간 오후 3시) 현재 28명이 현지에 머무르고 있다.</p><p> 전날 오후 10시 기준 30명에서 2명이 감소한 수치다. 이들 2명은 공관 지원 하에 폴란드로 안전하게 대피했다. 아울러 9명이 추가로 현지 상황을 봐 가면서 출국할 예정이라고 외교부는 덧붙였다.</p>",외교부
18,international,우크라이나 한국교민의 '생지옥' 같았던 탈출기,"<p> (코르쵸바[폴란드]=연합뉴스) 전성훈 특파원 = 얼굴 군데군데 긁힌 상처가 있었고, 오른손엔 5㎝가 넘는 길이의 큰 흉터가 선명했다.</p><p> 전쟁 발발 이후의 생활 그리고 피란길이 얼마나 처절하고 힘들었는지 대변하는듯했다. </p><p> 우크라이나를 빠져나온 정천식(59)씨는 11일(현지시간) 폴란드 코르쵸바 국경검문소를 간신히 넘었다. 탈출을 시도한 지 꼬박 닷새 만이었다.</p><p> 우크라이나 수도 키이우(키예프)에서 북동쪽으로 120㎞ 떨어진 체르니히우에서 제재소를 운영하던 정씨는 러시아의 침공 이후 그야말로 악몽과 같은 시간을 보냈다. </p><p> 체르니히우를 비롯한 키이우 북쪽은 개전 후 주요 공격 표적 가운데 하나였다. 가장 교전이 격렬한 곳이고 그만큼 피해도 큰 도시다. 인구 12만 명 규모의 소도시 체르니히우는 전체 도시의 절반이 쑥대밭이 됐다고 한다. </p><p> 정씨의 제재소에서 불과 3∼4㎞ 밖에 떨어지지 않은 곳에도 우크라이나 군기지가 하나 있었다.</p><p> 이곳도 러시아군의 공격 목표였는지 개전 이후 포성이 멈추지 않았다. 어느 날에는 하룻밤 새 수백 발의 러시아군 포탄이 떨어지기도 했다고 한다. </p><p> 정씨는 그 충격으로 지금도 15분 이상 잠을 자지 못한다고 말했다. 조그마한 소리에도 깜짝깜짝 놀라 잠을 설치기 일쑤다.</p><p> 우크라이나군은 길목에 있는 정씨의 제재소를 개전 직후부터 일찌감치 주둔지로 삼았다. 정씨는 이 때문에 한동안 30여명의 우크라이나 병사와 함께 생활해야 했다. </p><p> 처음에는 우크라이나군의 기밀정보를 러시아에 팔아넘기는 간첩으로 오해받아 심하게 폭행을 당하고 감금되기도 했다. 얼굴과 오른손의 상처도 그때 생겼다. </p><p> 정씨는 애초 제재소에 주둔한 우크라이나군의 도움을 받아 체르니히우를 빠져나갈 계획이었으나 하루가 다르게 전황이 악화하면서 결국 홀로 탈출을 감행했다. </p><p> 우크라이나군이 손으로 직접 그린 키이우행 '임도'(林道) 약도를 하나 받아 길을 나섰고, 한참을 헤맨 끝에 이틀 만에 키이우에 닿을 수 있었다고 한다. </p><p> 중간에 차량으로는 진입할 수 없는 상황에 부닥쳐 차는 버려놓고 와야 했다. 매 순간이 생사의 고비였다.</p><p> ""지나온 길이 생지옥 같았습니다""</p><p> 탈출 당시 호주머니에는 우리 돈으로 3천원도 안되는 우크라이나 현지 화폐가 있었다. 말 그대로 빈털터리 상태로 몸만 간신히 빠져나온 것이다. </p><p> 키이우에서 르비우까지 열차로 한 번에 온 그는 현지 지인의 도움으로 이틀 정도 숙식을 한 뒤 현지 우리 대사관 임시 사무소의 차를 타고 무사히 국경을 넘을 수 있었다. </p><p> 정씨가 목격한 키이우는 '죽은 도시' 같았다고 했다. 거리에 차도 사람도 별로 없었다. 거주지가 폭격을 맞아 잘 곳이 없는 시민들은 지하철 역사 내에서 정처 없이 노숙하는 상황이다. </p><p> 정씨는 ""러시아군이 이처럼 우크라이나를 전면 침공할 것이라고는 상상도 못 하고 그대로 있다가 탈출이 늦었다""면서 ""이제라도 빠져나올 수 있게 돼 다행""이라고 안도의 한숨을 내쉬었다.</p><p> 정씨는 12일 폴란드 수도 바르샤바에서 비행기를 타고 가족이 있는 한국으로 일단 돌아갈 예정이다.</p>",우크라이나
19,international,[우크라 침공] 전투기 제공 선 그은 美…옛소련제 대공미사일 지원 '만지작'," = 우크라이나에 대한 '구소련 전투기 지원' 방안에 반대 입장을 나타낸 미국이 옛 소련제 대공미사일을 지원하는 방안을 검토 중이라고 월스트리트저널(WSJ)이 10일(현지시간) 보도했다.</p><p> WSJ는 미 국방부와 유럽 외교 당국자 등의 발언을 근거로 미국을 중심으로 한 서방 국가들이 우크라이나 대공 방어력 강화를 위해 방공미사일 S-300(나토 분류명 SA-10) 등의 지원을 검토 중이라고 전했다.</p><p> S-300은 옛 소련에서 처음 생산돼 현재까지 활발하게 사용되고 있다. </p><p> 항공기뿐만 아니라 순항미사일을 요격할 수 있는 성능을 갖췄다. 이동식 발사대에 장착돼 적의 보복사격을 피해 이동할 수도 있다.</p><p> 우크라이나군이 이미 이 무기체계를 보유한 것이 지원 효과를 극대화할 수 있는 장점으로 꼽힌다. 별도의 교육·훈련이나 적응 과정 없이 공급한 무기를 바로 실전에 투입할 수 있기 때문이다. </p><p> WSJ는 서방 국가 관계자들이 S-300을 어디서 확보해 우크라이나에 제공할지는 밝히지 않았다면서 우크라이나와 지리적으로 가까운 나토 회원국과 불가리아, 그리스, 슬로바키아 등이 이 무기를 보유하고 있다고 전했다.</p><p> 유럽의 한 외교관은 WSJ에 ""우크라이나에 이런 무기를 제공한 국가에는 동맹국이 유사한 무기로 방어력을 보충해줄 수 있을 것""이라고 말했다.</p><p> 이 무기는 북대서양조약기구(NATO·나토) 회원국 등이 우크라이나에 앞서 제공한 견착식 열추적 미사일보다 정교한 성능을 가진 것으로 WSJ는 평가했다.</p><p> 미국과 나토 회원국은 우크라이나에 주로 '스팅어 지대공 미사일'을 제공해 왔다. 영국은 최근 '스타스트릭 초고속 휴대용 대공 미사일'을 지원하겠다고 밝힌 상태다. </p><p> 앞서 폴란드는 우크라이나에 옛 소련제 미그-29 전투기를 우크라이나 공군에 넘겨주는 대신 미국 측에 F-16 같은 미국산 전투기를 제공해달라고 요청했다.</p><p> 그러나 미국은 해당국을 상대로 한 러시아의 보복 공격에 따른 확전 가능성을 이유로 전투기 지원에는 소극적인 입장을 견지하고 있다. </p><p> 미 국방부는 우크라이나 방어력을 강화할 가장 좋은 방법은 러시아군 격퇴에 가장 필요한 대기갑·대공 무기 체계를 지원하는 것이라며 우크라이나 방공 방어력을 강화하겠다는 의지를 드러낸 바 있다.</p>",우크라이나
20,sports,"MLB 올스타 출신 투수 페레스, 자택서 추락사고로 사망"," = 미국프로야구 메이저리그(MLB) 로스앤젤레스(LA) 다저스 등에서 활약하며 통산 73승을 거둔 투수 오달리스 페레스(44)가 사고로 사망했다.</p><p> 미국 스포츠 전문 매체 ESPN은 11일(한국시간)은 ""페레스가 도미니카공화국에 위치한 자택에서 사고로 사망했다. 혼자 집에 있는 동안 사다리에서 추락한 것으로 보인다""고 전했다.</p><p> 페레스의 동생이 집에 도착해 마당에 누워있는 페레스를 발견했지만 이미 숨을 거둔 상태였던 것으로 알려졌다.</p><p> 1998년 애틀랜타 브레이브스에서 빅리그에 데뷔한 페레스는 2002년 LA 다저스로 트레이드돼 전성기를 누렸다. 2006년 이후에는 캔자스시티 로열스와 워싱턴 내셔널스 등에서 활동했다.</p><p> LA 다저스로 이적한 2002년에는 32경기에 출전해 15승 10패 평균자책점 3.00을 기록해 내셔널리그 올스타에 선정되기도 했다.</p><p> 2011년에는 한국프로야구(KBO) 진출을 위해 두산 베어스의 입단 테스트를 받을 예정이었지만 집안 사정으로 무산됐다.</p>",MLB
21,sports,"돌아온 양현종, 3이닝 퍼펙트…첫 출전 푸이그, 삼진만 2개(종합)"," = 프로야구 KIA 타이거즈의 에이스 양현종(34)이 완벽한 모습으로 돌아왔다.</p><p> 그러나 국내리그에 첫선을 보인 야시엘 푸이그(32·키움 히어로즈)는 높아진 스트라이크존 적응에 애를 먹었다.</p><p> KIA의 '돌아온 에이스' 양현종은 12일 창원 NC파크에서 열린 2022 KBO리그 시범경기 NC 다이노스와 개막전에 등판해 3이닝 동안 탈삼진 2개를 곁들여 무안타 무실점으로 막았다.</p><p> 빠른 공과 커브, 슬라이더, 체인지업을 고루 섞어 던지며 컨디션을 점검한 양현종은 쌀쌀한 날씨에도 최고 구속 146㎞를 던졌다. </p><p> 3회까지 투구 수는 당초 예상했던 45개보다 훨씬 적은 31개만을 기록했다.</p><p> 1회말 NC 1번 타자 박건우를 공 2개만으로 중견수 뜬공으로 잡은 양현종은 서호철은 2루수 땅볼, 외국인 타자 닉 마티니는 유격수 땅볼로 처리했다.</p><p> 2회말에는 양의지와 노진혁, 윤형준을 다시 범타로 처리한 양현종은 3회말 박준영과 오영수를 연속 삼진으로 잡은 뒤 김기환은 좌익수 파울플라이로 아웃시키며 3이닝 연속 삼자 범퇴를 기록, 에이스의 복귀를 알렸다. </p><p> KIA는 나지완의 솔로홈런 등 12안타를 몰아쳐 7-0으로 승리했다.</p><p> 지난겨울 NC에서 KIA로 이적한 나성범은 친정팀과 경기에서 몸맞는공 1개로 출루하고 2타수 무안타에 그쳤다.</p><p> KIA의 특급신인 김도영은 6회초 대주자로 나서 2루와 3루를 거푸 훔치는 순발력을 보였고 타석에서도 2타수 1안타로 매서운 솜씨를 보였다.</p><p> 두산에서 NC로 이적한 박건우는 2타수 무안타 1볼넷을 기록했다.</p><p> 고척돔에서는 쿠바 출신 '야생마' 푸이그가 두산 베어스와의 시범경기에 첫 출전 했다.</p><p> 이날 담 증세를 보여 출장 여부가 불투명했던 푸이그는 4번 타자 우익수로 선발 출전했으나 안타 없이 삼진 2개만 당했다.</p><p> 푸이그는 2회말 첫 타석에서 두산 좌완 선발 장원준을 상대로 2볼-2스트라이크에서 몸쪽 높은 직구를 지켜봤지만, 루킹 삼진을 당했다.</p><p> 예전 같으면 볼이었겠지만 올 시즌 확대된 스트라이크존의 영향으로 주심은 스트라이크를 선언했다. </p><p> 푸이그는 자신의 예상과 다른 판정에 당황한 표정을 짓다 더그아웃으로 돌아갔다.</p><p> 푸이그는 3회말 2사 1, 2루 찬스에서 맞이한 두 번째 타석에서도 두산 투수 윤명준의 커브에 헛스윙 삼진을 당했다.</p><p> 3회 종료 후에는 교체됐다.</p><p> 하지만 키움은 전병우와 박찬혁의 홈런포를 앞세워 5-2로 이겼다.</p><p> 4회부터 푸이그 대신 기용된 고졸 신인 박찬혁은 5회말 타석에서 두산 투수 김명신을 상대로 좌측 펜스를 훌쩍 넘어가는 솔로아치를 그려 눈길을 끌었다.</p><p> 키움 선발로 나선 외국인 투수 타일러 애플러는 2이닝을 무안타 무실점으로 막았다.</p><p> 부산 사직구장에서는 2016년 입단 동기인 임석진과 안상현이 홈런포를 가동한 SSG 랜더스가 롯데 자이언츠를 8-5로 꺾었다. </p><p> 임석진은 4-3으로 앞선 8회초 선두타자로 나서 최영환을 상대로 좌월 솔로홈런을 날렸다.</p><p> SSG는 김성현의 2루타와 김강민의 적시타로 1점을 보탠 뒤 안상현이 좌월 투런포를 쏘아 올려 8-3으로 달아났다.</p><p> 롯데는 패했지만, 선발로 나선 새 외국인 투수 찰리 반즈(28)가 4이닝을 4안타 1실점으로 막으며 무난한 신고식을 했다.</p><p> 최고 구속 147㎞, 평균 구속 143㎞를 기록한 반즈는 슬라이더와 체인지업, 투심패스트볼 등을 다양하게 뿌리며 탈삼진 4개도 곁들였다.</p><p> 지난겨울 롯데에서 SSG로 유니폼을 갈아입은 베테랑 노경은(38)은 이날 SSG 선발로 나서서 3⅔이닝 동안 9안타를 맞고 3실점 했다.</p><p> 68개의 공을 던진 노경은은 위기에서 삼진 4개를 뽑아 실점을 다소 줄였다.</p><p> 롯데 외국인 타자 D.J 피터스는 2회말 중월 2루타를 치는 등 3타수 1안타를 기록한 뒤 교체됐고 SSG 케빈 크론은 3타수 무안타에 그쳤다.</p><p> 수원에서는 LG 트윈스가 '디펜딩 챔피언' kt wiz를 5-0으로 제압했다.</p><p> LG는 유강남이 2루타 두 방, 문보경은 솔로홈런을 치며 공격을 주도했다.</p><p> 삼성에서 LG로 팀을 옮긴 박해민은 안타와 볼넷, 희생플라이를 고루 기록하며 알토란같은 활약을 펼쳤다.</p><p> 그러나 외국인 타자 리오 루이즈는 볼넷 1개만 얻고 2타수 무안타에 그쳤다.</p><p> kt는 이강철 감독을 비롯해 코치 및 선수 12명이 신종코로나바이러스 감염증(코로나19) 확진 판정을 받아 결장한 탓에 정상적인 경기를 펼치지 못했다. </p><p> 난타전이 펼쳐진 대구에서는 한화 이글스가 삼성 라이온즈를 9-7로 따돌렸다.</p><p> 한화는 7-7로 맞선 9회초 무사 1루에서 장지승의 2루타와 이해창의 적시타로 2점을 뽑았다.</p><p> 16안타를 몰아친 한화는 김태연이 3타수 3안타, 노시환이 2타수 2안타를 날렸다.</p><p> 1번 타자 중견수로 기용된 외국인 마이크 터크먼은 2루타 1개를 포함해 3타수 2안타를 기록했다.</p><p> 삼성은 오재일이 2점 홈런을 날렸고 호세 피렐라는 2타수 2안타를 기록했다.</p>",양현종
22,sports,"""FA 커쇼, 친정팀 다저스와 1년·1천700만 달러에 계약""(종합)"," = 미국프로야구 메이저리그(MLB) 로스앤젤레스 다저스의 프랜차이즈 스타 클레이턴 커쇼(34)가 계속 푸른색 유니폼을 입는다.</p><p> ESPN 등 현지 매체는 12일(한국시간) ""다저스는 자유계약선수(FA) 커쇼와 1년 1천700만 달러(약 210억 원)에 계약했다""고 일제히 전했다.</p><p> 커쇼는 조만간 신체검사를 받고 스프링캠프 개막에 맞춰 팀에 합류할 예정이다. </p><p> 커쇼는 다저스의 프랜차이즈 스타이자 아이콘이다.</p><p> 그는 2006년 신인드래프트를 통해 다저스에 입단한 뒤 2010년대 MLB 최고의 투수로 활약했다.</p><p> 2009년부터 2018년까지 내셔널리그 최우수선수상(MVP) 1회, 사이영상 3회 수상을 했고, 이 기간 단 한 시즌도 3점대 이상의 평균자책점을 기록하지 않았다.</p><p> 커쇼는 실력뿐만 아니라 모범적인 언행과 리더십으로 팬들에게 많은 사랑을 받았다.</p><p> 그러나 커쇼는 2019년부터 구위가 떨어지면서 기량이 쇠퇴했다.</p><p> 2021시즌엔 왼팔 전완근 통증에 시달리면서 10승 8패 평균자책점 3.55의 평범한 성적을 거뒀다.</p><p> 커쇼는 왼팔 부상으로 인해 포스트시즌을 소화하지 못했고, 그대로 자유계약선수(FA)가 됐다.</p><p> FA자격을 얻은 뒤엔 충격적인 소식이 전해졌다.</p><p> 다저스가 커쇼에게 퀄리파잉 오퍼(QO)를 제시하지 않은 것이다.</p><p> QO는 원소속구단이 FA에게 빅리그 고액 연봉자 상위 125명의 평균 연봉으로 1년 계약을 제시하는 제도다.</p><p> 보통 MLB 팀들은 FA시장에서 QO 금액 이상의 대우를 받을 만한 선수들에게 QO를 제시한다. 다저스는 커쇼의 시장 가치를 냉철하게 바라봤다.</p><p> 현지 매체에선 다저스가 커쇼를 잡지 않을 수 있다는 전망도 나왔다.</p><p> 이 상태로 MLB는 직장폐쇄에 들어갔고, 커쇼의 행방도 희미해졌다.</p><p> 이런 가운데 다저스는 MLB 노사 협상이 체결돼 FA 시장이 다시 열리자 커쇼와 계약을 서둘렀다.</p>",다저스
23,sports,[우크라 침공] 한국계 러시아 복서 비볼에 '불똥'…인생 최대 매치 취소되나," = 러시아의 침공으로 시작된 우크라이나 사태의 불똥이 한국계 무패 복서 드미트리 비볼(32·러시아)에게 튀고 있다.</p><p> 비볼은 5월 8일(한국시간) 미국 네바다주 라스베이거스에서 세계 프로복싱 미들급 최강자인 카넬로 알바레스(32·멕시코)와 격돌한다.</p><p> 지금껏 19승(11KO) 무패를 거둔 비볼에게는 인생 최대의 매치다. 알바레스의 지명도와 인기가 비볼이 그전까지 싸웠던 상대와는 비교조차 안 되기 때문이다.</p><p> 알바레스는 현 슈퍼미들급 통합 챔피언이자 '링' 매거진을 비롯한 각종 복싱 매체에서 전 체급을 통틀어 랭킹 1위를 달리는 현재 복싱 최고의 스타이다.</p><p> 현재 최고의 주가를 올리는 알바레스가 체급을 올려 비볼에게 도전장을 던졌으니, 비볼에게는 복이 저절로 굴러서 들어온 셈이다.</p><p> 비볼과 알바레스는 지난주 미국 샌디에이고를 시작으로 합동 프로모션에 나서며 홍보에 열을 올리고 있다. </p><p> 하지만 의외의 복병이 나타났다. </p><p> 전 세계가 우크라이나를 침공한 러시아를 규탄하고 제재를 가하는 가운데 그 여파가 러시아 국적인 비볼에게도 번졌다. </p><p> 러시아 제재에 동참하는 차원에서 비볼과 알바레스의 매치를 취소해야 한다는 목소리가 커지고 있다. </p><p> 비볼은 몰도바인 아버지와 한국인 어머니 사이에서 태어났다. 키르기스스탄에서 태어나 11살 때 러시아로 이주했다.</p><p> 비볼의 아내와 자녀, 가족들은 여전히 러시아에 살고 있다.</p><p> 이에 비볼은 ""우크라이나에 친구들이 많다""며 ""내가 원하는 건 오직 평화뿐이다. 우크라이나에 있는 친구들 때문에 정말로 슬프다. 매일 아침에 깨서 뉴스를 보면서 전쟁이 멈추길 희망하고 있다""고 진화에 나섰다. </p><p> 대회 주최 측은 자칫 역풍이라도 불까 봐 전전긍긍하고 있다. 둘의 경기를 보이콧해야 한다는 움직임이 커지면 수입에서도 큰 손실을 볼 수 있어서다.</p><p> 우크라이나의 복싱 영웅인 블라디미르 클리치코도 목소리를 냈다. </p><p> 조국 수호를 위해 자원입대한 클리치코는 10일 영국 BBC와의 인터뷰에서 비볼과 알바레스의 경기에 반대한다고 말했다.</p><p> 전 프로복싱 헤비급 세계 챔피언인 클리치코는 ""그 선수들을 반대해서가 아니다. 이건 러시아의 정치에 관한 것""이라며 ""러시아를 대표하는 모든 사람은 제재를 받아야 한다. 그렇게 해야 전 세계가 이 무의미한 전쟁에 반대하고 이 전쟁이 소용없다는 것을 러시아에 보여줄 수 있다""고 강조했다.</p>",비볼
