,카테고리,기사제목,전문,키워드
24,sports,"바뀐 스트라이크존에 당황한 푸이그, 첫 시범경기서 삼진만 2개"," = 야시엘 푸이그(32·키움 히어로즈)가 한국 프로야구 첫 시범경기에서 연타석 삼진을 당했다. </p><p> 푸이그는 12일 서울 고척스카이돔에서 열린 두산 베어스와의 2021 KBO리그 시범경기에서 2회말 첫 타석을 맞아 두산 좌완 선발 장원준에게 루킹 삼진을 당했다.</p><p> 푸이그는 1볼 상황에서 장원준의 슬라이더에 방망이를 크게 돌렸지만, 그물을 맞는 큼직한 파울이 됐다.</p><p> 이어 2볼-2스트라이크에서 장원준의 조금 높은 직구가 들어오자 그대로 지켜봤지만, 결과는 루킹 삼진이었다. </p><p> 예전 같으면 볼이었겠지만 올 시즌 확대된 스트라이크존의 영향으로 주심은 스트라이크를 선언했다. </p><p> 예상과는 다른 판정에 푸이그는 당황하며 잠시 타석에서 의아한 표정을 짓다가 더그아웃으로 돌아갔다.</p><p> 푸이그는 3회말 2사 1, 2루 찬스에서 맞이한 두 번째 타석에서도 두산 투수 윤명준의 커브에 헛스윙하며 삼진을 당했다.</p><p> 3회 종료 후 푸이그는 박찬혁과 교체되면서 한국 프로야구 첫 경기를 삼진 2개만 기록한 채 마쳤다.</p><p> 이날 푸이그는 경기 전 어깨 담 증상을 호소했지만, 결국 4번 타자 우익수로 선발 출전했다.</p><p> 2022시즌 KBO리그에서 뛸 외국인 선수 중 가장 주목받는 선수인 푸이그는 메이저리그(MLB) 통산 132개의 홈런을 쳐낸 강타자다.</p>",프로야구
25,entertainment,"김건희 여사, 통화 녹음 공개한 서울의소리 상대 손배소"," = 윤석열 대통령 당선인의 배우자 김건희 여사가 지난 1월 자신과 통화한 내용을 녹음해 공개한 인터넷 언론사 '서울의 소리' 관계자들을 상대로 소송을 낸 것으로 뒤늦게 확인됐다.</p>를 상대로 1억 원을 청구하는 손해배상 소송을 제기했다.</p><p> 김 여사는 소장에서 자신을 ""국민의힘 20대 대통령 선거 윤석열 후보자의 배우자""라고 소개하며 ""피고들의 불법적인 녹음 행위와 법원의 가처분 결정 취지를 무시한 방송으로 인격권과 명예권, 프라이버시권, 음성권을 중대하게 침해당했다""고 주장했다.</p><p> 법원은 이 사건을 환경·언론 사건 담당 재판부인 민사201단독 김익환 부장판사에 배당했다. 재판부는 아직 변론 또는 변론준비 기일을 지정하지는 않았다.</p>는 대선을 앞둔 지난 1월 중순 김 여사와 통화한 내용을 녹음했다며 MBC와 협업해 녹음 내용을 공개하겠다고 밝혔다.</p><p> 이에 김 여사는 녹음파일을 공개하지 못하게 해달라며 MBC와 서울의 소리를 상대로 가처분을 신청했지만, 법원은 일부 사생활과 관련한 내용만 제외하고 공개를 허용하는 취지의 결정을 내렸다.</p>의 통화 내용을 공개했다.</p>",김건희
26,entertainment,"배우 신구, 입원…연극 '라스트 세션' 내일 오영수가 대신 출연(종합)"," = 배우 신구(86)가 건강 문제로 입원 치료 중이다.</p><p> 연극 '라스트 세션' 제작사 파크컴퍼니 측은 11일 사회관계망서비스(SNS)를 통해 ""(극 중) 프로이트 역으로 출연 중인 신구 배우의 건강 문제로 인해 캐스팅 일정이 변경됐다""면서 12일 공연에는 신구 대신 오영수가 무대에 오른다고 밝혔다.</p><p> 이어 ""신구 선생님께서 최근 건강이 안 좋으신 상태에서도 관객과의 약속을 지키시기 위해 병원에 가지 않고 무대에 오르셨다""면서 ""선생님께서는 공연을 계속하길 원하셨으나 주변에서 설득해 어제(10일) 공연 종료 후 입원해 현재 치료 중""이라고 전했다.</p><p> 그러면서 ""관객과의 약속을 최우선으로 해오셨던 만큼 지금도 이 상황을 너무 힘들고 미안해하신다""라고 덧붙였다.</p><p> 제작사 측은 ""현재 심각하게 걱정할 상태는 아니며 뭐든 주의하는 게 좋을 것 같아 입원하게 됐다""고 설명했다.</p><p> 신구는 지난 1월부터 연극 '라스트 세션'에 출연해 열연을 펼쳐왔다.</p>",신구
27,entertainment,"""864일 기다렸어요""…팬데믹 뚫고 잠실 뒤덮은 BTS 보랏빛 물결"," = ""어떤 위기가 왔어도 우리는 방법을 찾아냈어요. 그리고 여기 우리가 다시 만나서 함께 있어요. 다음 무대 한번 가볼까요?"" (RM)</p><p> 그룹 방탄소년단(BTS)이 10일 서울 송파구 잠실종합운동장 주경기장에서 'BTS 퍼미션 투 댄스 온 스테이지 - 서울'(BTS PERMISSION TO DANCE ON STAGE - SEOUL) 공연의 막을 올렸다. </p><p> 2019년 10월 잠실 주경기장에서 열린 월드투어 공연 이후 약 2년 반 만에 국내 팬들과 만났다. 팬데믹 상황에서 이어진 864일간의 오랜 기다림이 드디어 결실을 보는 순간이었다. </p><p> 보랏빛 물결이 넘실대는 축제의 시작은 '온'(ON)이었다.</p><p> 일곱 명의 멤버가 '칼군무'(각 잡힌 군무)를 선보이며 좌중을 압도하자 공연장에는 박수 소리가 가득 찼다. 뜨겁게 달궈진 콘서트 분위기는 '불타오르네', '쩔어'로 이어졌다. </p><p> 멤버들이 '리듬 탈 준비 됐어요?'라고 말을 건네자 팬들은 응원봉을 높이 흔들어 응답했다. 영어 'T'자 형태로 만들어진 무대를 자유롭게 뛰어다니는 멤버들은 오랜 갈증을마음껏 푸는 듯했다. </p><p> 리더 RM은 ""마침내 다시 만났다""며 ""여러분이 객석에 있다는 것만으로도 많은 것이 달라졌다는 생각이 든다. 우리가 언제 박수로만 하는 콘서트를 해보겠나. 역사에 남을 콘서트일 것""이라고 말했다. <br/></p>""고 목소리를 높였다. </p><p> 공연에 앞서 '모든 것을 쏟아붓겠다'고 다짐했던 멤버들은 콘서트 내내 구슬땀을 흘리며 혼신의 힘을 다했다. </p><p> 정국은 팬들을 향해 ""정말 보고 싶었다. 가만히 있으면 추울 텐데 최대한 열심히 하겠다""며 ""단 하나의 후회가 남지 않도록 모든 것을 쏟아부을 테니 끝까지 즐겨달라""고 말했다. </p><p> 1만5천여 관객들은 종이 클래퍼(응원도구)로 뜨거운 함성을 대신했다.</p><p> 노랫말에 맞춰 팬들이 '짝짝' 내는 소리는 공연장 너머까지 울려 퍼졌다. 제이홉은 ""아미들의 에너지가 필요할 것 같다""며 손으로 클래퍼를 흔드는 듯한 제스처를 취하며 호응을 유도하기도 했다.</p><p> 진은 ""우리 '아미'(BTS 팬)들도 하고 싶은 말이 많겠지만 충분히 그 마음이 전달되니 끝까지 지켜봐 달라""며 온라인으로 공연을 보는 팬들에게도 ""같은 마음으로 후회 없이 즐겨달라""고 말했다. </p><p> 멤버들은 20여 곡을 부르는 동안 다양한 무대를 선보이며 팬들의 시선을 사로잡았다. </p><p> 무대 전면에 설치된 대형 LED는 멤버들의 모습을 생생히 담았고 곡 분위기에 따라 다채롭게 변했다. 멤버들은 이동차를 타고 공연장을 누비며 한 발짝 더 다가가 관객들과 함께 호흡했다.<br/></p><p> 공연이 막바지에 이르자 팬들은 하얀색 응원봉으로 파도타기를 하며 축제를 즐겼다. ""지난 2년 반 동안 기다렸을 것""이라는 슈가의 말처럼 관객석의 불빛은 형형색색으로 빛났다. </p><p> 2시간 30분 넘게 이어진 축제는 '퍼미션 투 댄스'(Permission To Dance)로 막을 내렸다. </p><p> BTS 멤버들은 하루빨리 공연장을 채우는 팬들의 함성을 들을 수 있으면 좋겠다고 바랐다. </p><p> 뷔는 ""2년 반 만의 콘서트라 정말 기대를 많이 하고 신나게 놀아야겠다고 했는데 어땠냐""며 ""다음에는 기필코 아미들의 목소리를 들을 때가 왔으면 한다""고 말했다.</p><p> RM은 ""훗날 이런 콘서트도 있었다고 말하며 최고의 안줏거리를 선사할 역사적인 공연에 감사드린다""며 ""더 좋은 모습으로 기립해서 함성 지르고 만나는 그날까지 지치지 말고 기다리겠다""고 약속했다. </p><p> 코로나19 사태 이후 최대 규모로 열린 공연인 만큼, 이날 공연장 곳곳에는 감염 예방을 위해 안전에 신경 쓴 모습이 엿보였다. </p><p> 전체 입장 인원의 5% 수준(약 750명)에 달하는 방역 관리 요원들은 관객석을 오가며 '함성을 삼가달라'고 안내했다. 공연이 끝난 뒤에는 구역별로 나눠 순차적으로 퇴장하도록 했다. </p><p> BTS의 이번 콘서트는 하루를 쉰 뒤 12일과 13일에 이어진다. </p><p> 12일 공연은 영화관에서 공연을 관람할 수 있는 '라이브 뷰잉'을 통해 전 세계에 생중계되며, 마지막 날인 13일에는 오프라인 공연과 함께 온라인 라이브 스트리밍이 동시에 진행된다. <br/></p><p> yes@yna.co.kr</p>",방탄소년단
28,entertainment,"美 '혐오범죄 자작극' 배우 스몰렛, 결국 실형 선고 받아","<p> (시카고=연합뉴스) 김현 통신원 = 미국 시카고에서 '동성애자·흑인 혐오범죄 자작극'을 벌인 혐의로 특별검사 수사까지 받은 배우 저시 스몰렛(39)이 결국 실형을 선고받았다.</p><p> 시카고를 관할하는 일리노이주 쿡카운티 형사법원은 10일(현지시간) 선고 공판에서 스몰렛에게 징역 150일, 보호관찰 30개월에 벌금 2만5천 달러(약 3천만원)를 부과하고, 과징금 13만 달러(약 1억6천만원)를 시카고 시에 내라고 명령했다. </p><p> 사건 발생 3년, 쿡카운티 검찰이 스몰렛을 기소했다가 돌연 철회해 파문이 일어 특검 수사가 시작된 지 2년 9개월 만의 판결이다.</p><p> 스몰렛은 작년 12월 열린 재판에서 경찰에 허위 피해 신고 및 거짓 진술을 한 사실과 관련한 5개 혐의에 대해 유죄 평결을 받았다. 그는 최고 징역 3년 형에 처해질 수 있었다. </p><p> 댄 웹 특별검사는 최후 논고를 통해 ""스몰렛은 대중의 관심을 끌기 위해 혐오범죄 거짓 신고를 하고 배심원단 앞에서 위증했다""며 ""징역형이 반드시 필요하다""고 강조했다. </p><p> 그러나 변호인단은 ""스몰렛에게 중범죄 전과가 없고 지금 받는 혐의도 비폭력 범죄""라면서 선처를 호소했다. </p><p> 제임스 린 판사는 ""스몰렛의 삶이 이미 크게 손상됐고 유명인으로서 이미 가혹한 처벌을 받았다는 점을 이해한다""면서도 ""동성애자 혐오 인종차별 피해를 꾸며내 사회정의에 대한 혼란을 야기했다""고 실형 선고 배경을 설명했다.</p><p> 인기 드라마 '엠파이어'(Empire)에 출연한 스몰렛은 2019년 1월 촬영지 시카고에서 혼자 밤길을 가던 중 도널드 트럼프 당시 대통령 지지자로 추정되는 남성 2명으로부터 흑인·동성애자 혐오범죄 피해를 봤다고 신고했다. </p><p> 그는 얼굴에 상처를 입고 목에 올가미가 감긴 사진을 소셜미디어에 올리고 용의자들이 인종차별 욕설과 함께 트럼프 캠페인 구호(MAGA)를 외치며 폭행했다고 주장했다.</p><p> 당시 대선 출마를 준비 중이던 조 바이든·카말라 해리스 등 민주계 유력 정치인들이 성소수자 혐오·인종차별을 규탄하고 스몰렛에 대한 지지를 표하면서 사태는 정치적 이슈로 부상했다. </p><p> 하지만 경찰 수사 결과, 용의자들은 엠파이어 단역배우인 흑인 형제이고 이 중 한 명은 스몰렛의 헬스 트레이너인 사실이 확인됐다. 용의자들은 돈을 받고 스몰렛의 자작극을 도왔다고 자백했다. </p><p> 결국 쿡카운티 검찰은 스몰렛을 16건의 중범죄 혐의로 기소했으나 한 달 만에 킴 폭스 검사장(민주)이 돌연 공소를 취하해 파문이 일었다. </p><p> 폭스 검사장이 버락 오바마 행정부에서 영부인 비서실장을 지낸 티나 첸 등으로부터 전화를 받고 스몰렛에게 면죄부를 준 사실이 알려져 스몰렛과 오바마 부부의 친분에 관심이 쏠리기도 했다. </p><p> 논란이 커지자 트럼프 당시 대통령은 연방 법무부에 공소 취하 배경을 살펴보라고 지시하기도 했다.</p><p> 법원은 특검제 도입을 결정했고, 재수사에 나선 특검은 스몰렛이 자작극을 계획하고 직접 참여했으며 경찰에서 허위 진술을 여러 차례 반복한 혐의가 있다고 재기소했다. </p><p> 아울러 폭스 검사장에 대해서는 ""권력층 청탁을 받고 스몰렛을 비호했으며 거짓 발표로 대중을 오도했다. 검찰 권력을 남용하고 사건 처리에 실패했다""는 이유로 일리노이 법조인 징계위원회에 고발했다.</p><p> 시카고 시는 스몰렛의 허위 신고로 경찰관 26명이 3천 시간을 투입해 일어나지도 않은 일에 대한 수사를 벌였다며 초과근무 수당 13만 달러 배상을 요구하는 소송을 제기해 놓은 상태다. </p><p> 또 자작극에 동원된 흑인 형제는 스몰렛 변호인단에 의해 명예를 훼손당했다며 손해배상 청구 소송을 냈다.</p>",혐오범죄
29,entertainment,"[우크라 침공] 유튜브 ""전 세계서 러시아 국영매체 접근 차단""","<p> (샌프란시스코=연합뉴스) 정성호 특파원 = 세계 최대 동영상 공유 플랫폼 유튜브가 전 세계에서 러시아 국영매체에 대한 접근을 차단하기로 했다고 AP·로이터 통신이 11일(현지시간) 보도했다.</p><p> 유튜브는 이날 전 세계적으로 러시아 국영매체와 연관된 채널에 대한 접근을 차단하기 시작했다고 밝혔다. 지금까지는 유럽 지역에서 RT와 스푸트니크 2개 매체만 차단했는데 지역과 대상을 모두 확대했다.</p><p> 유튜브는 잘 기록된 폭력적 사건을 부인하거나 축소하고, 사소한 일처럼 보이게 만드는 것을 금지하는 콘텐츠 규정을 이유로 들어 이같이 조치했다.</p><p> 그러면서 러시아의 우크라이나 침공이 이제 자사의 폭력적 사건 규정의 적용 대상이 된다며 규정을 위반한 게시물은 삭제될 것이라고 밝혔다.</p><p> 유튜브는 또 지금까지 러시아 내에서 광고를 중단해왔는데 러시아에서 자사 플랫폼을 이용해 돈을 버는 모든 방법으로 중단 대상을 넓히기로 했다.</p><p> 러시아 국영매체들은 앱스토어나 소셜미디어 등이 내린 차단 등의 규제 조치를 부당한 검열이라며 반발해왔다.</p><p> sisyphe@yna.co.kr</p>",러시아
