,카테고리,기사제목,전문,키워드
0,politics,"김건희 여사, 통화 녹음 공개한 서울의소리 상대 손배소"," = 윤석열 대통령 당선인의 배우자 김건희 여사가 지난 1월 자신과 통화한 내용을 녹음해 공개한 인터넷 언론사 '서울의 소리' 관계자들을 상대로 소송을 낸 것으로 뒤늦게 확인됐다.</p>를 상대로 1억 원을 청구하는 손해배상 소송을 제기했다.</p><p> 김 여사는 소장에서 자신을 ""국민의힘 20대 대통령 선거 윤석열 후보자의 배우자""라고 소개하며 ""피고들의 불법적인 녹음 행위와 법원의 가처분 결정 취지를 무시한 방송으로 인격권과 명예권, 프라이버시권, 음성권을 중대하게 침해당했다""고 주장했다.</p><p> 법원은 이 사건을 환경·언론 사건 담당 재판부인 민사201단독 김익환 부장판사에 배당했다. 재판부는 아직 변론 또는 변론준비 기일을 지정하지는 않았다.</p>는 대선을 앞둔 지난 1월 중순 김 여사와 통화한 내용을 녹음했다며 MBC와 협업해 녹음 내용을 공개하겠다고 밝혔다.</p><p> 이에 김 여사는 녹음파일을 공개하지 못하게 해달라며 MBC와 서울의 소리를 상대로 가처분을 신청했지만, 법원은 일부 사생활과 관련한 내용만 제외하고 공개를 허용하는 취지의 결정을 내렸다.</p>의 통화 내용을 공개했다.</p>",김건희
1,politics,"이탄희, 文대통령 '안희정 근조화환'에 ""피해자 상황에 무감각"""," = 더불어민주당 이탄희 의원은 12일 문재인 대통령이 부친상을 당한 안희정 전 충남도지사에게 근조화환을 보낸 데 대해 ""섬세하지 못했고 피해자의 상황에 대해 무감각했다고 생각한다""고 말했다. </p><p> 이 의원은 이날 페이스북에서 ""논란이 있고, 양측 입장을 모두 이해는 한다""면서 이같이 언급했다. </p><p> 이 의원은 ""안 전 지사 성폭력 사건은 대법원에서 유죄가 선고돼 징역 3년 6개월의 형이 확정됐다""며 ""그런데도 피해자의 일상과 사회적 명예는 회복되지 않았다""고 강조했다. </p><p> 이어 ""최근에는 전 국민 앞에서 대통령 당선자 부인의 목소리로 2차 가해를 당하는 일도 겪었다""고 말했다.</p><p> 그는 ""이러한 상황에서 대통령 직함 등의 근조화환은 피해자에 대한 사회적 포위망을 더 강화하는 효과를 낳는다""며 ""신중했어야 한다. 개인 자격으로 또는 비공개로 위로할 방법도 있었다""고 강조했다.</p><p> 이 의원은 ""이런 무감각한 태도를 바꾸지 않으면 민주당이 추진하는 '연합정치' 정치개혁안도 성공할 수 없다""며 ""안 전 지사 성폭력 사건에서부터 '피해자 관점을 가진 사람'이 민주당과 함께할 수 있도록 태도를 바꿔야 한다. 그렇지 않으면 결국 민주당이 국민으로부터 고립되는 날이 온다""고 주장했다.</p>",이탄희
2,politics,"""평생 집밥해주겠다"" 尹당선인, 이메일로 프러포즈"," = 윤석열 대통령 당선인과 부인 김건희 여사의 결혼 10주년 기념일인 11일 두 사람의 러브 스토리가 뒤늦게 공개됐다.</p><p> 윤 당선인 측이 공개한 주변 전언에 따르면, 윤 당선인은 김 여사를 처음 만난 뒤 명함을 보관하지 않고 일부러 버렸다고 한다. </p><p> 내심 김 여사가 마음에 들었지만, 나이 차이(12살)가 크게 나고 여러 여건상 남녀 관계로 이어지기는 어렵다는 생각에 처음부터 포기하려 했다는 것이다.</p><p> 그러나 윤 당선인은 얼마 지나지 않아 김 여사에게 이메일로 마음을 표현했고, 이를 알게 된 지인들의 도움으로 다시 만나는 자리가 마련됐다고 한다. </p><p> 윤 당선인이 김 여사가 건넨 명함을 버리기 전에 이메일 주소를 통째로 외워버렸다가 망설인 끝에 연락한 것이라는 후문이다. </p>회견에서 윤 당선인과의 첫 만남을 회고한 바 있다.</p><p> 그는 ""검사라고 하기에 무서운 사람인 줄만 알았다""며 ""하지만 늘 같은 옷을 입고 다니고 자신감이 넘치고 후배들에게 마음껏 베풀 줄 아는 그런 남자였다""고 돌아봤다.</p><p> 그러면서 ""몸이 약한 저를 걱정하며 '밥은 먹었냐', '날씨가 추운데 따듯하게 입어라' 제게 늘 전화를 잊지 않았다""고 했다. </p><p> 한편, 김 여사는 언론에 보낸 메시지에서 윤 당선인에 대해 ""늘 바빠도 제게는 언제나 다정한 사람이었다""며 ""남편에게 가장 감동한 말은 '평생 집밥 해줄게'였다""고 말했다.</p><p> 이어 ""연애 때 사업하느라 바빠 식사를 제대로 못 챙기던 모습을 남편이 안쓰러워했다""며 ""결혼할 때 평생 밥해주겠다고 약속했는데, 10년이 지난 지금까지도 잘 지키고 있다. 국민과 한 약속은 더 잘 지킬 것으로 믿고 있다""고 덧붙였다.</p><p> 그는 '어떤 대통령 배우자가 되고 싶은가'란 질문에 ""당선인이 국정에 전념하도록 내조하겠다""며 ""남편이 소임을 마치면 저도 현업에 복귀해 활동을 이어갈 것""이라고 답했다. </p><p> hanjh@yna.co.kr</p>",김건희
3,politics,"디씨 '이재명 갤러리' 관리자 실종 소동…경찰, 신병 확보"," = 더불어민주당 이재명 후보와 관련된 온라인 커뮤니티의 관리자가 이 후보의 낙선 확정 직후 유서를 남기고 실종됐다가 경찰에 발견되는 소동이 벌어졌다.</p><p> 11일 경찰에 따르면 경기 시흥경찰서는 전날 오후 3시께 물왕동 물왕저수지 인근에서 '디시인사이드 이재명 갤러리' 관리자인 A(31)씨를 발견해 가족에게 신병을 인계했다. A씨는 건강에 별다른 문제는 없는 상태였다. 그가 현장에서 극단적 선택을 시도한 흔적은 발견되지 않은 것으로 전해졌다.</p><p> A씨는 전날 오전 10시께 이재명 갤러리에 ""영혼 절반이 떨어져 나간 것 같다""며 ""이곳을 총괄하는 동안 온갖 음해와 협박에 시달려 그 고통은 이루 말할 수가 없다""는 내용의 유서를 남기고 휴대전화를 끈 채 연락이 두절됐다.</p><p> 그는 유서에 ""어렸을 때는 (극단적 선택을 한) 민영환과 전태일이 왜 죽었는지 이해가 가지 않았는데 이제야 이해가 된다""면서 ""스스로를 제물로 내던져서라도 사람들에게 호소하고 거대한 부정적 흐름을 막고 싶은 심정이었기 때문""이라고 적었다.</p><p> 이후 글을 본 커뮤니티 회원들과 가족이 경찰에 실종 신고를 했다. 시흥경찰서는 A씨 아버지의 신고를 접수한 서울 은평경찰서로부터 전날 오후 2시 40분께 관련 공조 요청을 받고 수색에 나섰다.</p><p> 앞서 이 후보는 지난해 11∼12월 이재명 갤러리에 세 차례 글을 올려 2030세대 남성을 겨냥한 정책 등을 발표했다.</p>",이재명
4,politics,"'샴페인' 터트린 국민의힘…이준석 ""하하, 이제 여당 대표다"""," = ""하하, 여당 대표다""</p><p> 10일 오후 열린 국민의힘 의원총회장은 이준석 대표가 인사말을 시작하자 의원과 당직자들의 큰 박수와 환호로 가득 찼다. </p><p> 전날 치러진 제20대 대선에서 윤석열 대통령 당선인을 탄생시킨 국민의힘 당지도부와 선대본부 관계자들은 그야말로 축제 분위기 속에 하루를 보냈다. </p><p> 의총에 앞서 윤 당선인이 참석한 가운데 열린 선대본부 해단식에서도 현장은 박수가 그칠 새가 없었고 곳곳에서 윤 당선인과 지도부를 연호하는 함성이 터져 나왔다. </p><p> 이 대표는 ""파란만장했다. 각고의 노력을 했고, 모두가 이 노력을 해서 지금의 이 영광이 있는 게 아닌가. 특히 의원님들의 위력을 확인했다""며 웃는 얼굴로 말문을 열었다. </p><p> 이 대표는 ""(민주당이 다수인) 지방 행정과 180석을 상대로 해서 치른 이 선거는 최고의 난도였다""며 ""앞으로 어떤 선거도 지지 않기 위해 고군분투해야 할 것 같다""고 말했다.</p><p> 그러면서 ""앞으로 함께할 영광들이 기대되고, 탄핵의 아픔을 겪은 정당에 5년 만에 다시 기회를 주신 국민께 감사하고 낮은 자세로 가야 하겠다""며 선거 승리의 소회를 밝혔다.</p><p> 이어 ""윤 당선인을 서포트하기 위해, 여소야대를 처음 경험한다. 우리가 여당의 역할을 하면서 180석을 상대하려면 서로 힘을 합치지 않으면 해결을 못 할 일이 많을 것 같다""며 ""언제든지 지도부가 요청할 것이 있으면 뛰어가겠다""고 말했다. <br/></p><p> 이 대표는 또 ""빠른 시일 내에 노정희 (중앙선거관리위원회 위원장) 책임을 물어야 한다""며 ""애초에 국회의원이 국민을 대신해 (부실관리 논란에 대해) 항의하는 데 그렇게 대응한 것은 선관위가 오만방자한 것이다. 강하게 규탄하고 책임 있는 인사를 요구해야 한다""며 오는 6월 지방선거를 앞두고 준비 태세를 다잡았다.</p><p> 의총장에는 대선과 동시 실시된 3·9재보궐선거 국회의원 당선인 4명이 함께해 들뜬 분위기를 더했다. 국민의힘은 이번 재보선 국회의원 선거에서 지역구 5곳 중 4곳을 '싹쓸이'했다.</p><p> 정우택(충북 청주상당·5선) 당선인은 이번 대선 결과에 대해 ""'하늘에서 우리나라를 버리지 않는구나' 이런 생각을 감히 한다""고 했고, 김학용(경기 안성·4선) 당선인은 ""민주당 정부의 지난 5년을 거울로 삼아서 하면 지방선거에서도 이길 수 있다""며 각오를 다졌다.</p><p> 이번에 처음 금배지를 달게 된 최재형(서울 종로) 당선인은 ""이번 대선과 보선을 통해 국민께서는 국민에 군림하는 정권이 어떻게 되는지를 보여줬다""고 했고, 조은희(서울 서초갑) 당선인은 ""윤석열 정부가 성공하는 데 미력하나마 최선을 다하겠다""며 포부를 밝혔다.<br/></p><p> '원내사령탑'인 김기현 원내대표는 ""아픈 역사 딛고 쓰는 새로운 역사다. 폐족이 된 거 아니냐, 대선·지방선거 2번을 연이어서 지면서 다시 일어설 수 있을까, 걱정과 한탄이 지배했다""고 그동안을 회고했다. 그러면서 ""(오늘은) 기분 좋은 날이다. 대통령 당선으로 여당이 됐고 네 분 보선 당선으로 겹경사""라고 말해 박수갈채를 받았다. </p><p> 김 원내대표는 이어진 발언에서 ""대야""를 ""대여""로 바꿔 말하며 ""아 헷갈리네""라며 웃음을 터뜨렸고, 이에 장내에서도 ""말 똑바로 하세요""라며 웃음 섞인 반응이 터져 나왔다. </p><p> 윤 당선인은 의총에는 참석하지 않았으나, 앞서 열린 선대본부 해단식에서 의원, 당직자들과 인사를 나누고 선거운동 기간 노고에 감사를 표했다.</p><p> 윤 당선인은 ""우리 동지들과 함께 국민 속으로 들어가서 많은 분을 만나고 얘기를 듣고, 함께 껴안고, 비비고 해보니 이 헌법 정신이라는 게 어떤 건지, 민주주의라는 게 어떤 건지 뜨겁게 가슴으로 다가왔다. 정말 많은 걸 배웠다""고 말해 박수갈채를 받았다. </p><p> 윤 당선인은 ""이제 정부를 인수하게 되면 윤석열의 행정부만이 아니라 국민의힘의, 국민의힘이라는 여당의 정부가 된다""고 강조하며 원활한 당·청 관계에 의지를 피력했다. </p><p> 해단식에서는 이 대표와 김 원내대표, 권영세 총괄선거대책본부장 겸 사무총장 등 이번 선거를 진두지휘한 '지도부 3인방'이 나란히 무대에 올라 윤 당선인에게 꽃다발을 건넸고, 청년 보좌역들은 음악 소리와 구호에 맞춰 어깨를 들썩이며 환호를 보냈다. <br/></p><p> minaryo@yna.co.kr</p>",이준석
5,economy,"20대 5급 공무원 10명 중 6명 ""기회 된다면 이직 의향 있다"""," = 20대 5급 공무원 10명 중 6명은 기회가 된다면 이직을 할 의향이 있다는 조사 결과가 나왔다.</p><p> 한국행정연구원은 ㈜리서치앤리서치에 의뢰해 작년 8월12일~9월30일 중앙부처와 광역자치단체 일반직 공무원 4천명을 대상으로 실시한 '공직생활실태조사'에서 이런 결과가 나왔다고 12일 밝혔다. </p><p> 같은 응답을 한 비율은 6~7급에서는 44.6%, 8~9급에서는 43.6%였다. </p><p> 연구원은 이른바 MZ세대(1980년대초∼2000년대초 출생)로 불리는 20대~30대 공무원은 동료나 조직에 대한 관심, 조직에 헌신하고자 하는 의지 등 '조직시민행동 인식'이 다른 세대에 비해 상대적으로 낮았다고 밝혔다. </p><p> 연구원은 ""20대~30대가 개인적 가치와 사적 영역을 중시하는 반면, 40대와 50대는 공동체와 조직의 가치를 보다 중요하게 인식하는 것이 드러났다""고 설명했다. </p><p> 다만 이런 '조직시민행동 인식'은 2013년과 비교하면 20대~30대뿐 아니라 전체 연령대에서 전반적으로 하락했다. <br/></p><p> 5점 만점 척도에서 50대 공무원의 긍정응답 수준은 3.73점에서 3.65점으로 0.08점 낮아졌다. 20대의 경우 긍정응답 점수는 3.62점에서 3.34로 0.28점 하락해 낙폭이 컸다. </p><p> 근무평정, 보상 등 '공정성' 문제에 대해서도 20대~30대의 인식은 다른 연령대보다 낮은 편이었다. </p><p> '내가 받는 보수는 내 업무성과에 비춰 적정하다'는 명제에 대해 1점(전혀 그렇지 않다)에서 5점(매우 그렇다)의 점수를 매기게 했는데 20대가 2.55점으로 가장 낮았고 30대 역시 2.59점으로 낮은 편이었다. 40대는 2.80점이었고 50대 이상은 3.20점으로 가장 높았다. </p><p> 비슷한 공정성 관련 항목의 연령대별 평균 점수는 2013년에는 20대 3.29점, 30대 2.93점, 40대 3.01점, 50대 이상 3.08점이었는데 20대의 하락 폭이 가장 컸다. </p><p> '개인이 갖는 공공봉사의 중요성'에 대한 평가에도 긍정 응답 비율은 연령대가 낮을수록 낮은 편이었다. 20대가 43.1%, 50대 이상이 76.1%로 차이가 컸다.</p><p> 반면 '공직생활의 안정성'에 대한 평가에서는 20대 56.2%, 30대 54.7%, 40대 52.3%, 50대 이상 60.7%로 전연령대가 비슷한 수준이었다. </p><p> 연구원은 ""생산성에 상응하는 보수체계로 개편해 호봉이 낮은 MZ세대 공무원들에게 동기부여를 강화해야 한다""며 ""이직 의향이 높은 20대 5급 공무원에 대해 삶의 질 제고, 자긍심과 성취감 고취, 체계적인 리더십 프로그램 제공 등이 필요하다""고 제언했다. </p><p> 연구원은 15일 오후 국회의원회관 대회의실에서 '데이터로 본 한국사회 MZ세대의 인식'을 주제로 세미나를 개최하고, 공직생활 실태조사 결과와 사회통합실태조사 내용을 소개한다.</p>",공무원
6,economy,고점대비 -85%…대선 끝나자 후보 테마주 줄줄이 폭락," = 제20대 대선이 막을 내리면서 작년부터 증시를 뜨겁게 달군 대선 테마주들이 후보 당락과 관계없이 대체로 폭락했다.</p><p> 대선이라는 재료가 소멸하자 그간 기업 가치와 무관하게 후보와 학연 등으로 얽히거나 정책 수혜주로 엮여 폭등한 종목들이 상승 폭을 반납하고 있다.</p><p> 12일 한국거래소에 따르면 낙선한 더불어민주당 이재명 후보 테마주인 이스타코[015020]는 3월 들어 지난 11일까지 1천840원에서 1천210원으로 34.24% 하락했다.</p><p> 특히 선거를 하루 앞둔 8일 9.03% 하락 마감했고, 대선 다음날인 10일(-6.03%)과 11일(-8.68%)에도 급락세를 이어갔다.</p><p> 지난 10일에는 장중 1천110원까지 내렸다. 작년 6월 29일에 찍은 역대 장중 최고가 7천550원과 비교하면 8개월여 만에 85.30% 떨어진 수준이다.</p><p> 유가증권시장에 상장한 이스타코는 부동산 매매·임대업을 하는 회사다. 주가는 2020년 말 677원으로 '동전주' 신세였다가 이 후보의 공공주택 정책 테마주로 거론되며 급등한 바 있다.</p><p> 특히 이스타코의 지난해 상반기 주가 상승률은 무려 882.27%로 당시 코스피와 코스닥을 통틀어 가장 높았다.</p><p> 다른 '이재명 테마주'의 3월 주가 추이를 봐도 TS트릴리온[317240] -34.92%, 에이텍[045660] -32.28%, 에이텍티앤[224110] -25.44%, 형지엘리트[093240] -21.66% 등 20% 이상 하락한 종목이 많다.</p><p> 이 같은 주가 급락세는 윤석열 대통령 당선인 관련 테마주도 마찬가지다.</p><p> '윤석열 테마주' 중 하나인 영어교육 업체 NE능률[053290]은 이달 들어서만 1만2천700원에서 8천330원으로 34.41% 내렸다.</p><p> 대선 전 사흘 연속 급락(4일 -6.59%·7일 -9.96%·8일 -16.68%)하고서 당선을 확정지은 10일 소폭 상승(0.33%) 마감했으나 11일에 다시 8.16% 떨어졌다.</p><p> 코스닥 상장사인 NE능률은 최대주주인 윤호중 hy(옛 한국야쿠르트) 회장이 윤 당선인과 같은 파평 윤씨라는 이유로 '윤석열 테마주'로 엮였다.</p><p> 그러면서 주가는 2020년 말 2천845원에서 작년 6월 9일 장중 3만750원까지 10배 이상으로 치솟았다.</p><p> 지난 11일 기록한 장중 연저점 8천290원을 기준으로 NE능률의 전고점 대비 주가 하락률은 73.04%에 이른다.</p><p> 또 덕성우[004835](-36.95%), 덕성[004830](-35.24%), 서연[007860](-23.25%) 등 '윤석열 테마주'로 유명한 여러 종목이 3월 들어 주가 하락률이 20%를 넘었다.</p><p> 다만 일부 윤 당선인 테마주의 경우 대선 직후 주가가 과열 양상을 보였다.</p><p> 중견 건설업체 삼부토건[001470]은 대선 다음날인 지난 10일 가격제한폭(29.89%)까지 치솟아 상한가를 기록했으며 11일에도 5.66% 상승했다.</p><p> 삼부토건은 조남욱 전 회장 측이 과거 윤 당선인에게 김, 멜론, 곶감, 밤, 정육 등 명절 선물을 보낸 것으로 알려지면서 테마주로 묶였다. 또 최근 최대주주 지분 매각설도 주가 급등 재료로 작용했다.</p><p> 선거철마다 기승을 부리는 정치인 테마주는 대부분 기업 실적과 관계없이 급등락해 투자자들의 각별한 유의가 필요하다.</p><p> 특히 주가가 선거 기간에 이상 급등하고서 재료가 소멸하는 선거일을 기점으로는 급락하는 경우가 많다.</p><p> 금융감독원은 ""대선 테마주는 주가 변동성이 크고 예측이 어려워 투자 매우 위험이 높다""며 ▲ 테마 실체 확인 ▲ 거래 급증 종목에 유의 ▲ 이미 주가가 급등한 종목 추종 매수 자제 ▲ 허위 사실이나 풍문 전달 및 이용 금지 등을 당부했다.</p>",대선
